Gạt tàn TTS,Hàng Gốm Sứ,TTS/GT,Cái,0,0,200.000,0
Lọ tăm TTS,Hàng Gốm Sứ,TTS/TAM,Cái,0,0,150.000,0
Nón bọc vải lụa 2 mặt phi 43,"Nón, Nón treo",NBVL/2/43,Cái,0,0,400.000,0
Tranh sơn mài vuông cong 30x30,Hàng Sơn Mài,SM/TR/VC30,Cái,0,0,350.000,0
Đĩa vuông sơn mài hình lá size M,Hàng Sơn Mài,SM/D/V/LA/M,Cái,0,0,110.000,0
Đĩa vuông sơn mài hình lá size L,Hàng Sơn Mài,SM/D/V/LA/L,Cái,0,0,120.000,0
Đĩa vuông sơn mài hình cô gái size S,Hàng Sơn Mài,SM/D/V/G/S,Cái,0,0,100.000,0
Đĩa vuông sơn mài hình cô gái size L,Hàng Sơn Mài,SM/D/V/G/L,Cái,0,0,120.000,0
Khay chữ nhật gắn trai KT: 26x35,"Khay tre, khảm trai, gỗ",KCNGT/26X35,Cái,0,0,220.000,0
Khay bầu dục gắn trai KT 21x30,"Khay tre, khảm trai, gỗ",KBDGT/21x30,Cái,0,0,250.000,0
Khay bầu dục gắn trai KT 23x35,"Khay tre, khảm trai, gỗ",KBDGT/23x35,Cái,0,0,180.000,0
Bộ AC HL trăng vàng to,Hàng Gốm Sứ,TACHL029,Bộ,0,0,800.000,0
Bộ AC nâu ganh quai việt,Hàng Gốm Sứ,TACHL017,Bộ,0,0,800.000,0
Khay bầu dục gắn trai có quai KT: 24 x 37,"Khay tre, khảm trai, gỗ",KBDCQ/24X37,Cái,-1,0,180.000,0
Khay chữ nhật gắn trai có tay cầm KT:25X35,"Khay tre, khảm trai, gỗ",KCNGTCTC/25X35,Cái,-1,0,200.000,0
Nón Huế trơn trẻ em phi 34,"Nón, Nón treo",NHTTE/34,Cái,-1,0,60.000,0
Đĩa vuông sơn mài cô gái xanh dương size M,Hàng Sơn Mài,SM/DV/XD/G/M,Cái,-1,0,110.000,0
Nón cỏ bàng vẽ nổi phi 41,"Nón, Nón treo",NCBVN/41,Cái,-1,0,350.000,0
CHÂN KÊ ĐĨA GỖ 23-24 CM,Thủ công mỹ nghệ,CKD/23-24,Cái,-1,0,70.000,0
Bộ ac Hl nâu hoa chìm,Hàng Gốm Sứ,TACHL027,Bộ,-1,0,800.000,0
Đĩa F22 trâu sen,Hàng Gốm Sứ,TS/D/F22,Cái,-2,0,200.000,0