Tên sản phẩm,Loại sản phẩm,Mã SKU,Đơn vị,LC_CN1_Tồn kho ban đầu,LC_CN1_Giá vốn khởi tạo,PL_Giá bán lẻ,PL_Giá nhập
Nam châm tủ lạnh,Thủ công mỹ nghệ,KG03,Chiếc,611,0,10.000,0
Cao sao vàng 3g (HP),Cao,8934900020016,Lọ,380,0,5.000,0
Thuốc lá bao Lotus Trầm (20 điếu vỏ vàng),"Xì Gà, Thuốc Lá",8936031838812,Bao,302,0,60.000,0
Bưu ảnh( Post ảnh),Thủ công mỹ nghệ,KG/ANH,Chiếc,237,0,10.000,0
Đũa gỗ khảm trai,Đũa,SM/DUA,Đôi,220,0,8.000,0
Thuốc lá Trump Silver demi BCNĐ,"Xì Gà, Thuốc Lá",8936031837396,Bao,172,0,40.000,0
Xì gà Domica slim (30 điếu/hộp),"Xì Gà, Thuốc Lá",8936030311156,Hộp,160,0,150.000,0
Nam châm tăm,Thủ công mỹ nghệ,KG02,Chiếc,148,0,10.000,0
Thìa men kem,Hàng Gốm Sứ,THDTH001,Cái,147,0,30.000,0
Xì gà Lotus Slim (Hộp giấy 30 điếu),"Xì Gà, Thuốc Lá",8936031838690,Bao,145,0,100.000,0
Đũa dừa khẩu,Đũa,DUA/D/K,Đôi,140,0,6.000,0
Đũa thốt nốt,Đũa,DUA/TN,Đôi,140,0,6.000,0
Bookmark ảnh,Thủ công mỹ nghệ,KG01/A,Chiếc,118,0,10.000,0
đĩa muối vuông vẽ CL,Hàng Gốm Sứ,T/DMV/CL,Cái,111,0,40.000,0
Đũa gỗ đầu ngọc,Đũa,DUA/G/DN,Đôi,110,0,8.000,0
GỐM TREO DECO MINI,Hàng Gốm Sứ,T/GTDC/MN,Cái,95,0,30.000,0
Gác đũa HB,Hàng Gốm Sứ,HB/GD,Cái,94,0,30.000,0
Thìa vẽ các loại L1,Hàng Gốm Sứ,ATVE01,Cái,92,0,30.000,0
Thìa cf các loại,Hàng Gốm Sứ,ATCF01,Cái,90,0,20.000,0
Đĩa muối men kem cl,Hàng Gốm Sứ,T/DM/MK,Cái,86,0,30.000,0
Bookmark tre,Thủ công mỹ nghệ,KG01,Chiếc,83,0,10.000,0
Thìa cà phê vẽ CL N,Hàng Gốm Sứ,ATCF01N,Cái,77,0,20.000,0
Thuốc lá bao Lotus Xì Gà Supper Slim BCNĐ 20 điếu/bao,"Xì Gà, Thuốc Lá",8936031835736,Gói,76,0,50.000,0
Gác đũa các loại,Hàng Gốm Sứ,gdcl,Cái,70,0,30.000,0
Cốc sen HB,Hàng Gốm Sứ,HB/C/SEN,Cái,67,0,80.000,0
Gác đũa vẽ CL N,Hàng Gốm Sứ,AGD/01N,Cái,63,0,30.000,0
Bookmark to,Thủ công mỹ nghệ,KG01/L,Chiếc,62,0,15.000,0
Mũ lưỡi trai cờ đỏ sao vàng,"Nón, Nón treo",MLTCDSV,Cái,60,0,40.000,0
Cốc trụ chấm,Hàng Gốm Sứ,HB/C/T/VC,Cái,60,0,80.000,0
Bát gáo dừa gắn trai,Hàng Sơn Mài,SM/BGDT,Cái,56,0,60.000,0
THÌA CF CL,Hàng Gốm Sứ,THCF/CL,Cái,55,0,10.000,0
Bát gáo dừa đồng quê NT,Hàng Sơn Mài,SM/BGD/DQ/NT,Cái,53,0,50.000,0
Đũa gỗ trắc cao cấp gắn trai(10đôi/vỉ),Đũa,G/DUA/CCTRAI,Đôi,49,0,50.000,0
Gác đũa CL men kem,Hàng Gốm Sứ,T/GD/MK,Cái,48,0,30.000,0
Bát cơm hỏa biến sen,Hàng Gốm Sứ,HB/BC/SEN,Cái,48,0,70.000,0
ĐÔI ĐŨA SỨ,Đũa,T/DDUA/SU,Đôi,44,0,20.000,0
Ví 2 khoá cô gái KT: 17x21,"Túi xách, Làn, Ví",V2KCG/17x21,Cái,42,0,50.000,0
Rượu Thanh Long 19% 100ml,Rượu,8938528985559,Chai,40,0,150.000,0
Cốc lọc trà TM,Hàng Gốm Sứ,CLTM01,Chiếc,40,0,120.000,0
Phin cà phê F8 đã in logo Thống Nhất,Phin CF,PCP/8/I/TN,Cái,40,0,80.000,0
"Áo T-shirt 5 cỡ (quang gánh, bản đồ, cô gái AD, phở)",Quần Áo,FV/A,Cái,39,0,300.000,0
Cốc lọc CF TM,Hàng Gốm Sứ,CFTM01,Cái,38,0,120.000,0
Gác thìa các loại men kem,Hàng Gốm Sứ,T/GTH/MK,Cái,37,0,30.000,0
Hạt điều hộp xếp hình hoa,"Đồ Ăn, Thức Uống",HD/H,Hộp,37,0,100.000,0
Gác đũa men xanh ngọc,Hàng Gốm Sứ,MXN/GD,Cái,36,0,30.000,0
Cốc lọc trà 2 lớp,Hàng Gốm Sứ,CLTM04,Bộ,35,0,120.000,0
Rượu mơ Yên Tử 100ml 19%,Rượu,8936105590097,Chai,35,0,150.000,0
Gác rượu SM,Hàng Sơn Mài,SM/GRU,Cái,35,0,180.000,0
MR.VIET Arabica - Cà Phê Rang Xay Túi 250g (MR.VIET Arabica - Ground Coffee 250g Bag),"Đồ Ăn, Thức Uống",8938506647851,Gói,34,0,200.000,0
Ví nắp lượn KT: 12X19,"Túi xách, Làn, Ví",VNL/12X19,Cái,33,0,50.000,0
Đĩa chấm men xanh ngọc,Hàng Gốm Sứ,MXN/DM,Cái,32,0,25.000,0
Rượu Sim Yên Tử 100ml 24%,Rượu,8936105590103/100,Chai,32,0,150.000,0
Cốc HB xanh dương,Hàng Gốm Sứ,HB/C/XD,Cái,30,0,80.000,0
Cốc hb có quai vẽ cl,Hàng Gốm Sứ,HB/C/Q/VE,Chiếc,30,0,90.000,0
Rượu mận ủ (Rồng may mắn) 16% 100ml,Rượu,M1MU0716100,Chai,29,0,150.000,0
Trà Hoa Hồng,"Đồ Ăn, Thức Uống",TRA/HH,Gói,29,0,50.000,0
Cốc Hb có quai XD,Hàng Gốm Sứ,HB/C/Q/XD,Cái,29,0,90.000,0
Hít giấy xoắn 3D,Thủ công mỹ nghệ,HGX/3D,Cái,28,0,30.000,0
Bát cơm vẽ hoa cl,Hàng Gốm Sứ,ABCOM02,Cái,27,0,50.000,0
Cốc CF thẳng có quai,Hàng Gốm Sứ,CF/CT/CQ,Cái,27,0,60.000,0
Rượu mùa cốm 100ml,Rượu,8938528985320,Chai,26,0,150.000,0
xoài sấy dẻo lọ 500g,"Đồ Ăn, Thức Uống",XSD/L/500G,Lọ,26,0,120.000,0
Trà Atiso đỏ,"Đồ Ăn, Thức Uống",TRA/ATS,Gói,26,0,60.000,0
Cốc CF thẳng ko quai 4 màu,Hàng Gốm Sứ,CF/CT/4M,Cái,26,0,60.000,0
MẸT F25 VẼ PHONG CẢNH CL,Thủ công mỹ nghệ,TMET2501,Cái,26,0,500.000,0
Nón dây thổ cẩm,"Nón, Nón treo",ND/TC,Cái,26,0,100.000,0
Hộp trang sức SM hình chữ nhật KT 9x18,Hàng Sơn Mài,SM/HTS/9x18,Cái,26,0,300.000,0
"Áo dài hoa nhí, các loại",Quần Áo,CL/AODAI/HOA,Chiếc,25,"15.044,33",400.000,0
Bộ đũa bao gấm 5 đôi/1 vỉ,Đũa,DBG/5DOI,Vỉ,25,0,120.000,0
Sprite 320ml - hương chanh.,"Đồ Ăn, Thức Uống",8935049501718,Lon,24,0,12.000,0
Ken bia 330ml (chai lẻ),"Đồ Ăn, Thức Uống",8934822202330,Chai,24,0,24.000,0
Cốc vuốt HB,Hàng Gốm Sứ,HB/C/V,Cái,24,0,80.000,0
Áo dài thêu,Quần Áo,CL/AODAI/THEU,Chiếc,24,"7.912,09",600.000,0
"""MR.VIET Cà Phê Đường Phố - Cà Phê Rang Xay Túi 250g (MR.VIET Street Coffee - Ground Coffee 250g Bag)""","Đồ Ăn, Thức Uống",8936135431599,Gói,24,0,160.000,0
Nước khoáng Lavie 500ml (chai lẻ),"Đồ Ăn, Thức Uống",8935005801029,Chai,23,0,6.000,0
Trà San Tuyết,"Đồ Ăn, Thức Uống",TRA/ST,Gói,23,0,50.000,0
Bát mắm HB sen,Hàng Gốm Sứ,HB/BMM/SEN,Cái,23,0,50.000,0
Cốc HB,Hàng Gốm Sứ,C/HB,Cái,23,0,80.000,0
Hộp trang sức SM vuông 10x10,Hàng Sơn Mài,SM/HTS/10x10,Cái,23,0,200.000,0
Lọ mini vẽ các loại,Hàng Gốm Sứ,T/LH/MN/VE,Cái,23,0,50.000,0
Trà sâm dứa,"Đồ Ăn, Thức Uống",TRA/SD,Gói,23,0,60.000,0
MR.VIET Robusta - Cà Phê Rang Xay Túi 250g (MR.VIET Robusta - Ground Coffee 250g Bag),"Đồ Ăn, Thức Uống",8936135431773,Gói,23,0,160.000,0
Hà Nội bia 330ml (lon lẻ),"Đồ Ăn, Thức Uống",8936000440039,Lon,22,0,15.000,0
Móc khóa len thỏ cờ,Len,LEN/MKTC,Cái,22,0,60.000,0
Trà xanh hoa nhài,"Đồ Ăn, Thức Uống",TRA/XHN,Gói,22,0,120.000,0
Nấm đông trùng (GÓI),"Đồ Ăn, Thức Uống",NAM/DT,Gói,22,0,80.000,0
Chuông gió nhỏ,Hàng Gốm Sứ,CG01,Cái,22,0,100.000,0
Phin cà phê F7 đã in logo Thống Nhất,Phin CF,PCP/7/I/TN,Cái,22,0,70.000,0
Hạt điều lọ 500g,"Đồ Ăn, Thức Uống",H/DIEU/500G,Hộp,22,0,125.000,0
Cam Sơn mài phi 8,Hàng Sơn Mài,SM/CAM8,Cái,22,0,80.000,0
MẸT F20 VẼ PHONG CẢNH CL,Thủ công mỹ nghệ,TMET2001,Cái,22,0,400.000,0
Sài gòn bia 330ml (lon lẻ),"Đồ Ăn, Thức Uống",8935012413321,Lon,21,0,15.000,0
Sổ ảnh Notebook,Thủ công mỹ nghệ,KG06,Cái,21,0,30.000,0
Rượu Hồng Liên 100ml,Rượu,8938528985962,Chai,21,0,150.000,0
Khay muối vuông HB sen,Hàng Gốm Sứ,HB/KHM/V/SEN,Cái,21,0,40.000,0
Cốc bút SM,Hàng Sơn Mài,SM/CB,Cái,21,0,100.000,0
Cốc cao men HB,Hàng Gốm Sứ,ACOCC002,Cái,21,0,60.000,0
Cốc CF màu (nhỡ),Hàng Gốm Sứ,CFTM07,Cái,21,0,60.000,0
Quýt sơn mài phi 10,Hàng Sơn Mài,SM/QUYT10,Cái,21,0,150.000,0
Hộp trang sức SM hình chữ nhật KT 8x12,Hàng Sơn Mài,SM/HTS/8x12,Cái,21,0,250.000,0
Rượu em mơ 100ml,Rượu,8938528985023,Chai,20,0,150.000,0
Thước len rùa 1,Len,LEN/TR1,Cái,20,0,50.000,0
ĐŨA DỪA DỌC,Đũa,DUA/D/D,Đôi,20,0,6.000,0
Lọ chày sơn mài 20,Hàng Sơn Mài,SM/L/CHAY/20,Lọ,20,0,100.000,0
Cốc lipton có nắp,Hàng Gốm Sứ,CTM02,Cái,20,0,80.000,0
Cốc HB có quai chấm,Hàng Gốm Sứ,HB/C/Q/C,Cái,20,0,90.000,0
Thước len rùa 2,Len,LEN/TR2,Cái,19,0,50.000,0
Cốc bộ độc ẩm HB,Hàng Gốm Sứ,HB/C/1M,Cái,19,0,100.000,0
MR.VIET Cà Phê Hương Chồn - Cà Phê Rang Xay Túi 250g (MR.VIET Chon - Ground Coffee 250g Bag),"Đồ Ăn, Thức Uống",8938506647912,Gói,19,0,200.000,0
"""MR.VIET Cà Phê Đà Lạt - Cà Phê Rang Xay Túi 250g (MR.VIET Dalat - Ground Coffee 250g Bag)""","Đồ Ăn, Thức Uống",8938506647561,Gói,19,0,160.000,0
Nón Huế vẽ phong cảnh phi 40,"Nón, Nón treo",NHVPC/40,Cái,19,0,100.000,0
Hộp phấn sơn mài phi 10,Hàng Sơn Mài,SM/PHAN/10,Cái,19,0,150.000,0
Xoài sấy dẻo muối ớt gói 500g,"Đồ Ăn, Thức Uống",XSD/MO/500G,Gói,18,0,120.000,0
Túi CN thêu 15x24x4,"Túi xách, Làn, Ví",CLY/TT15244,Cái,18,0,100.000,0
Túi xách đeo vai cô gái Việt Nam nhỏ KT: 34x26cm,"Túi xách, Làn, Ví",TXDVCGVN/34X26,Cái,18,0,100.000,0
Kẹo Hải Hà cứng Bạc Hà gói 70g,"Đồ Ăn, Thức Uống",8934595021190,Gói,18,0,10.000,0
Trà ướp bông sen hộp 2 bông,"Đồ Ăn, Thức Uống",TUBS/H/2,Hộp,18,0,120.000,0
XOÀI SẤY DẺO GÓI 500G,"Đồ Ăn, Thức Uống",XSD/500G,Gói,18,0,120.000,0
Ấm bộ độc ẩm HB,Hàng Gốm Sứ,HB/AM/1M,Cái,18,0,250.000,0
Phin cà phê F6 đã in logo Thống Nhất,Phin CF,PCP/6/I/TN,Cái,18,0,65.000,0
Đèn lồng tròn 40cm,Đèn lồng,DL/TRON/40,Cái,18,0,150.000,0
Trà Ô long Phú Sỹ vàng 100g,"Đồ Ăn, Thức Uống",8938505114583,Gói,18,0,70.000,0
MR.VIET Good Morning Vietnam - Cà Phê Rang Xay Túi 250g (GM Vietnam - Ground Coffee 250g Bag),"Đồ Ăn, Thức Uống",8938506647882,Gói,18,0,180.000,0
Móc khóa len cô gái áo dài đeo nón,Len,LEN/MKCGADDN,Cái,17,0,100.000,0
"Móc khóa len vịt ếch, vịt dâu",Len,LEN/MKVEVD,Cái,17,0,80.000,0
Xì gà LOTUS NO 2 (hộp sắt màu vàng),"Xì Gà, Thuốc Lá",8936031834234,Hộp,17,0,850.000,0
Xì gà Lotus MINI NO 2 (hộp sắt màu đen),"Xì Gà, Thuốc Lá",8936031835897,Hộp,17,0,250.000,0
Đèn lồng tỏi 30cm,Đèn lồng,DL/TOI/30,Cái,17,0,150.000,0
Bánh dừa nướng TopCoco HAPI gói 150g,"Đồ Ăn, Thức Uống",8938544489062,Gói,16,0,30.000,0
Rượu táo mèo yên bái 19% 100ml,Rượu,8938528985894,Chai,16,0,150.000,0
Bát sơn mài (bát gỗ),Hàng Sơn Mài,SM/BAT,Cái,16,0,70.000,0
Gác đũa HB sen,Hàng Gốm Sứ,HB/GD/SEN,Cái,16,0,35.000,0
Xì gà Lotus Victory ( hộp giấy 5 điếu ),"Xì Gà, Thuốc Lá",8936031840556,Hộp,16,0,1.200.000,0
Đèn lồng tỏi 45cm,Đèn lồng,DL/TOI/45,Cái,16,0,200.000,0
"Sổ nhỏ ( vuông,hcn)",Thủ công mỹ nghệ,KG/SO/VCN,Cái,15,0,30.000,0
Cặp tóc len,Len,LEN/CT,Cái,15,0,20.000,0
Túi vải canvas in phong cảnh KT: 28x34,"Túi xách, Làn, Ví",TV/CANVAS/PC/28X34,Cái,15,0,150.000,0
Khay muối vuông HB,Hàng Gốm Sứ,HB/KHM/V,Cái,15,0,30.000,0
Đèn lồng tròn 45cm,Đèn lồng,DL/TRON/45,Cái,15,0,200.000,0
MR.VIET Cà Phê Hương Chồn- Cà Phê Hạt Rang (MR.VIET Chon- Roasted Coffee Beans) 250g,"Đồ Ăn, Thức Uống",8936135432954,Gói,15,0,220.000,0
Lót ly Sơn mài,Hàng Sơn Mài,SM/LOTLY,Cái,15,0,200.000,0
Rượu chanh leo đà lạt 19% 100ml,Rượu,8938528985870,Chai,14,0,150.000,0
Túi Canvas phong cảnh 32x35cm,"Túi xách, Làn, Ví",CLY/TCVS,Cái,14,0,150.000,0
Rượu gái mèo 100ml,Rượu,8938528985504,Chai,14,0,150.000,0
Kẹo Hải Hà cứng nhân Dâu gói 80g,"Đồ Ăn, Thức Uống",8936007390603,Gói,14,0,10.000,0
Gác rượu trứng,Hàng Sơn Mài,SM/GRU/TR,Cái,14,0,180.000,0
Quần áo dài đẹp,Quần Áo,CLY/QD,Cái,14,0,180.000,0
Đèn lồng tỏi 40cm,Đèn lồng,DL/TOI/40,Cái,14,0,150.000,0
Sầu riêng sấy lạnh Vinamit 60g,"Đồ Ăn, Thức Uống",8934743572178,Gói,14,0,100.000,0
Mr.Viet Hazelnut- Drip Bag Coffee 100g (MR.VIET Cà Phê Hương Hạt Dẻ- Cà Phê Phin Giấy 100g),"Đồ Ăn, Thức Uống",8936135432855,Gói,14,0,160.000,0
Mr.Viet Arabica- Drip Bag Coffee 100g (MR.VIET Cà Phê Arabica- Cà Phê Phin Giấy 100g),"Đồ Ăn, Thức Uống",8936135432862,Gói,14,0,160.000,0
Rượu xí muội 19% 100ml,Rượu,8938528985900,Chai,13,0,150.000,0
Côc HB vẽ,Hàng Gốm Sứ,C/HB/VE,Cái,13,0,80.000,0
Túi mề gà thêu 16x27,"Túi xách, Làn, Ví",CLY/TMG1627,Cái,13,0,100.000,0
Tranh sơn mài vuông cong 20x20,Hàng Sơn Mài,SM/TR/VC20,Cái,13,0,250.000,0
Xì gà LOTUS NO 1 (hộp giấy 5 điếu nâu),"Xì Gà, Thuốc Lá",XG/N/NO1,Hộp,13,0,650.000,0
Đèn lồng tròn 20cm,Đèn lồng,DL/TRON/20,Cái,13,0,100.000,0
Hoa Đậu Biếc,"Đồ Ăn, Thức Uống",HOA/DB,Gói,13,0,50.000,0
Túi trống phi 20,"Túi xách, Làn, Ví",T/TRONG/20,Cái,13,0,200.000,0
Trà quế túi lọc Cộng (2gr x20),"Đồ Ăn, Thức Uống",CPC/TQ/L,Hộp,13,0,80.000,0
MR.VIET Cà phê đen Americano (MR.VIET Americano Coffee),"Đồ Ăn, Thức Uống",8936135430202,Gói,13,0,120.000,0
Mr.Viet Chon- Drip Bag Coffee 100g (MR.VIET Cà Phê Hương Chồn- Cà Phê Phin Giấy 100g),"Đồ Ăn, Thức Uống",8936135432879,Gói,13,0,170.000,0
Bát gáo dừa đồng quê đỏ,Hàng Sơn Mài,SM/BGD/DQD,Cái,13,0,50.000,0
Hộp phấn sơn mài phi 6,Hàng Sơn Mài,SM/PHAN/6,Cái,13,0,70.000,0
Rượu chanh giấy miền tây 19% 100ml,Rượu,8938528985863,Chai,12,0,150.000,0
Rượu cô chanh 100ml,Rượu,8938528985474,Chai,12,0,150.000,0
Đĩa muối HB,Hàng Gốm Sứ,HB/DMU,Cái,12,0,40.000,0
Đĩa muối HB sen,Hàng Gốm Sứ,HB/DMU/SEN,Cái,12,0,40.000,0
Thìa cơm trâu sen,Hàng Gốm Sứ,THC/TS,Cái,12,0,30.000,0
Trà hoa cúc (gói),"Đồ Ăn, Thức Uống",TRA/HC,Gói,12,0,50.000,0
Bộ AC lõm quai mây,Hàng Gốm Sứ,TACTN01,Bộ,12,0,250.000,0
Xì gà LOTUS NO 1 (hộp giấy 5 điếu vàng),"Xì Gà, Thuốc Lá",XG/V/NO1,Hộp,12,0,650.000,0
CAPHE MOKA GÓI 200G,"Đồ Ăn, Thức Uống",CP/M/200G,Gói,12,0,140.000,0
Đèn lồng tròn 30cm,Đèn lồng,DL/TRON/30,Cái,12,0,150.000,0
Đĩa kê cốc CF xanh lá,Hàng Gốm Sứ,DCF/XL,Cái,12,0,20.000,0
Đèn lồng tỏi 35cm,Đèn lồng,DL/TOI/35,Cái,12,0,150.000,0
Cốc cà phê cao hoả biến,Hàng Gốm Sứ,T/CFTM/H/HB,Cái,12,0,120.000,0
Chân kê đĩa gỗ 18cm,Thủ công mỹ nghệ,CKD/18,Cái,12,0,50.000,0
Hộp trang sức SM hình chữ nhật KT 14x24,Hàng Sơn Mài,SM/HTS/14x24,Cái,12,0,500.000,0
Cam Sơn mài phi 16,Hàng Sơn Mài,SM/CAM16,Cái,12,0,200.000,0
Rượu quất hồng bì 100ml,Rượu,4938522985955,Chai,11,0,150.000,0
Capybara cầm cờ Việt Nam,Len,LEN/CPBARACCVN,Con,11,0,150.000,0
Móc khóa len gấu đeo cờ size to,Len,LEN/MKGDC/T,Cái,11,0,100.000,0
Kẹo Hải Hà Chew sầu riêng gói 90g,"Đồ Ăn, Thức Uống",8934595060434,Gói,11,0,15.000,0
Cốc ngọc trai,Hàng Gốm Sứ,C/NT,Cái,11,0,80.000,0
Nón lụa vẽ nổi F43,"Nón, Nón treo",NLVN/43,Cái,11,0,500.000,0
Xì gà Lotus Short ( hộp giấy 10 điếu),"Xì Gà, Thuốc Lá",8936031841195,Hộp,11,0,450.000,0
Bát gáo dừa hoa sen đỏ,Hàng Sơn Mài,SM/BGD/SEN/D,Cái,11,0,50.000,0
Cốc lọc trà nắp màu,Hàng Gốm Sứ,CLTM02/5M,Cái,11,0,100.000,0
Đèn lồng tròn 35cm,Đèn lồng,DL/TRON/35,Cái,11,0,150.000,0
Hạt điều gói 500g,"Đồ Ăn, Thức Uống",H/DIEU/G/500G,Gói,11,0,125.000,0
Khay tre hcn 22x35x3,"Khay tre, khảm trai, gỗ",KTHCN/22X35X3,Cái,11,0,140.000,0
Túi cói đeo vai KT: 21x31,"Túi xách, Làn, Ví",TCDV/21X31,Cái,11,0,200.000,0
Mít sấy vinamit MP gói 100g,"Đồ Ăn, Thức Uống",8934743042909,Gói,11,0,50.000,0
Xì gà HANOS - HNC56 ( ống nhôm 1 điếu),"Xì Gà, Thuốc Lá",XIGA/HNC56,Điếu,11,0,900.000,0
Bát tre gắn trai,Hàng Sơn Mài,SM/BATTRE,Cái,11,0,70.000,0
Tranh sơn mài vuông 20x20,Hàng Sơn Mài,SM/TR/V20,Cái,11,0,250.000,0
Ví thổ cẩm hình cú khóa chuông KT 22x13,"Túi xách, Làn, Ví",TC/VHCKC/22X13,Cái,10,0,100.000,0
Rượu mận máu Hoàng Su Phì 100ml,Rượu,8938528985917,Chai,10,0,150.000,0
Túi mây hình chữ nhật thảm trai,"Túi xách, Làn, Ví",TMHCNTT,Cái,10,0,240.000,0
Thước len mix các loại,Len,LEN/TMCL,Cái,10,0,60.000,0
Tranh đĩa tròn sơn mài cong phi 20,Hàng Sơn Mài,SM/TR/DTC20,Cái,10,0,250.000,0
Bát cơm men kem CL,Hàng Gốm Sứ,T/BC/MK,Cái,10,0,40.000,0
Khay vuông gắn trai có tay cầm KT:30cm,"Khay tre, khảm trai, gỗ",KVGTCTC/30,Cái,10,0,220.000,0
Thuốc lá bao Lotus Slim- NĐ,"Xì Gà, Thuốc Lá",8936031838799,Bao,10,0,20.000,0
Bộ trà nhỏ 4C,Hàng Gốm Sứ,TACTN04,Bộ,10,0,200.000,0
Chén Sake HB sen,Hàng Gốm Sứ,SAKE/C/HB/SEN,Cái,10,0,30.000,0
Làn nhựa cỡ M KT: 25-39cm,"Túi xách, Làn, Ví",LN/M/25-39,Cái,10,0,250.000,0
Bát gáo dừa hoa sen vàng,Hàng Sơn Mài,SM/BGD/SEN/V,Cái,10,0,50.000,0
Hộp Phấn sơn mài phi 8,Hàng Sơn Mài,SM/PHAN/8,Hộp,10,0,80.000,0
Đèn lồng tròn 10cm,Đèn lồng,DL/TRON/10,Cái,10,0,50.000,0
Trà Matcha tam đường 100g,"Đồ Ăn, Thức Uống",8936095570307,Gói,10,0,150.000,0
Túi xách thổ cẩm quai gỗ KT: 34x30,"Túi xách, Làn, Ví",TC/TXQG/34X30,Cái,10,0,100.000,0
Mít sấy vinamit MP gói 210g,"Đồ Ăn, Thức Uống",8934743012131,Gói,10,0,110.000,0
Trà xanh túi lọc Cộng (2gr x20),"Đồ Ăn, Thức Uống",CPC/TX/L,Hộp,10,0,80.000,0
Trà hoa Lài túi lọc Star Kitchen,"Đồ Ăn, Thức Uống",8938532872555,Hộp,10,0,110.000,0
MR.VIET Cà Phê Hòa Tan 2 trong 1 (MR.VIET 2 in 1 Instant Coffee),"Đồ Ăn, Thức Uống",8936135430219,Gói,10,0,120.000,0
Bình phu thê SM cỡ trung,Hàng Sơn Mài,SM/VC/M,Bộ,10,0,500.000,0
Kẹo chew nho đen Hải Hà 90G,"Đồ Ăn, Thức Uống",8934595060472,Gói,9,0,10.000,0
Móc khóa len mix đội nón,Len,LEN/MKMDN,Cái,9,0,50.000,0
Đĩa mặt trời S2 vẽ hoa CL,Hàng Gốm Sứ,ADMT01,Cái,9,0,150.000,0
Ví lụa thêu hoa 12x19,"Túi xách, Làn, Ví",CLY/VI1219,Cái,9,0,50.000,0
Kẹo Hải Hà nhân Dứa gói 80g,"Đồ Ăn, Thức Uống",8936007390580,Gói,9,0,10.000,0
Gác thìa HB sen,Hàng Gốm Sứ,HB/GTH/SEN,Cái,9,0,35.000,0
Xì gà Lotus MINI NO 2 (hộp sắt màu nâu),"Xì Gà, Thuốc Lá",8936031835910,Hộp,9,0,250.000,0
Cốc bộ độc ẩm vẽ cl,Hàng Gốm Sứ,T/C/1M/CL,Cái,9,0,100.000,0
Lót ly gắn trai,Hàng Sơn Mài,SM/LOTLY01,Bộ,9,0,170.000,0
Ví thổ cẩm cầm tay nắp lượn,"Túi xách, Làn, Ví",TC/VI/NL12X20,Cái,9,0,50.000,0
Cốc C phong cảnh HN,Hàng Gốm Sứ,COCC03,Cái,9,0,80.000,0
Bánh đậu xanh Hòa An hộp 100g,"Đồ Ăn, Thức Uống",8938539983049,Hộp,9,0,15.000,0
Hạt macca lọ 500g,"Đồ Ăn, Thức Uống",H/MACCA/500G,Hộp,9,0,130.000,0
Đĩa kê cốc CF đỏ,Hàng Gốm Sứ,DCF/D,Cái,9,0,20.000,0
Đĩa kê cốc cf nâu,Hàng Gốm Sứ,DCF/N,Cái,9,0,20.000,0
Khay tre hcn 25x38x3,"Khay tre, khảm trai, gỗ",KTHCN/25X38X3,Cái,9,0,150.000,0
Giá đũa,Đũa,TDTMV80,Bộ,9,0,100.000,0
Hít vỉ 3 tem vàng,Thủ công mỹ nghệ,HV3TV,Cái,9,0,60.000,0
Bát gáo dừa cô gái vàng,Hàng Sơn Mài,SM/BGD/GAI/V,Cái,9,0,50.000,0
Bát gáo dừa đồng quê xanh dương,Hàng Sơn Mài,SM/BGD/DQXD,Cái,9,0,50.000,0
Bát gáo dừa đồng quê vàng,Hàng Sơn Mài,SM/BGD/DQV,Cái,9,0,50.000,0
Nón Huế vẽ hoa sen phi 40,"Nón, Nón treo",NHVHS/40,Cái,9,0,100.000,0
Nón trẻ em vẽ phi 34,"Nón, Nón treo",NTEV/34,Cái,9,0,80.000,0
Khay tròn thảm gỗ có quai KT phi 22,"Khay tre, khảm trai, gỗ",KTTGCQ/22,Cái,9,0,120.000,0
Cam Sơn mài phi 11,Hàng Sơn Mài,SM/CAM11,Cái,9,0,110.000,0
TRÀ HOA NHÀI (LỌ),"Đồ Ăn, Thức Uống",TRA/HNHAI,Lọ,8,0,60.000,0
Chóe mini vẽ các loại,Hàng Gốm Sứ,ACH05,Cái,8,0,300.000,0
Rượu Kim Quất 100ml,Rượu,8938528985887,Chai,8,0,150.000,0
Rượu Mơ Yên Tử 250ml 19%,Rượu,8936105590158,Chai,8,0,200.000,0
Rượu mùa Hà Nội 100ml,Rượu,8938528985665,Chai,8,0,150.000,0
Kẹo Hải Hà cứng nhân xoài gói 80g,"Đồ Ăn, Thức Uống",KHH/CU/X/80G,Gói,8,0,10.000,0
Móc khóa len đeo ảnh Hà Nội,Len,LEN/MKDAHN,Cái,8,0,60.000,0
Móc khóa len nón cờ,Len,LEN/MKNC,Cái,8,0,50.000,0
Móc khóa len mochi,Len,LEN/MKMOCHI,Cái,8,0,50.000,0
Con Trai Sơn Mài,Hàng Sơn Mài,SM/CONTRAI,Cái,8,0,300.000,0
Làn cói (các màu),"Túi xách, Làn, Ví",CLY/MAU,Cái,8,0,170.000,0
Kẹo Hải Hà Jelly hương nho gói 100g,"Đồ Ăn, Thức Uống",8934595063169,Gói,8,0,20.000,0
Kẹo Hải Hà chew khoai môn gói 90g,"Đồ Ăn, Thức Uống",8934595060526,Gói,8,0,10.000,0
Đĩa F14 men kem,Hàng Gốm Sứ,T/D14/MK,Cái,8,0,50.000,0
Thìa cơm hỏa biến,Hàng Gốm Sứ,THC/HB,Cái,8,0,30.000,0
Xì gà Vinaboss's 55 (ống nhôm 1 điếu),"Xì Gà, Thuốc Lá",XG/VNB/55,Điếu,8,0,550.000,0
Ấm bộ độc ẩm vẽ cl,Hàng Gốm Sứ,T/AM/1M/CL,Cái,8,0,150.000,0
Cà phê Arabica gói 500g,"Đồ Ăn, Thức Uống",CP/A/500G,Gói,8,0,320.000,0
Cà phê Culi 500g,"Đồ Ăn, Thức Uống",CP/C/500G,Gói,8,0,300.000,0
Túi xách cúc dừa thổ cẩm KT: 33x22,"Túi xách, Làn, Ví",TC/TXCD/33x22,Cái,8,0,150.000,0
Ví thổ cẩm thêu,"Túi xách, Làn, Ví",VGTC,Cái,8,0,200.000,0
Cà phê túi lọc Độc Lập,"Đồ Ăn, Thức Uống",CPC/CF/DL/L,Hộp,8,0,90.000,0
Cà phê túi lọc Tự Do,"Đồ Ăn, Thức Uống",CPC/CF/TD/L,Hộp,8,0,100.000,0
Cà phê túi lọc phở Việt Nam,"Đồ Ăn, Thức Uống",CPC/CF/PVN/L,Hộp,8,0,100.000,0
MR.VIET Cà Phê Hương Hạt Dẻ - Cà Phê Rang Xay Túi 250g (MR.VIET Hazelnut - Ground Coffee 250g Bag),"Đồ Ăn, Thức Uống",8936135430738,Gói,8,0,160.000,0
MR.VIET Arabica - Cà Phê Hạt Rang Túi 250g (MR.VIET Arabica - Roasted Coffee Beans 250g Bag),"Đồ Ăn, Thức Uống",8936135430264,Gói,8,0,220.000,0
Quýt sơn mài phi 6,Hàng Sơn Mài,SM/QUYT6,Cái,8,0,80.000,0
Khay vuông gắn trai có tay cầm KT: 35cm,"Khay tre, khảm trai, gỗ",KVGTCTC/35,Cái,8,0,280.000,0
Khay tròn gắn trai KT: phi 28,"Khay tre, khảm trai, gỗ",KTGT/28,Cái,8,0,220.000,0
Kẹo xoài xanh bóc vỏ Vietthai 255g,"Đồ Ăn, Thức Uống",8936029721850,Gói,7,0,35.000,0
Rượu mơ má đào Mộc Châu 100ml,Rượu,8938528985931,Chai,7,0,150.000,0
bát chiết yêu F11 vẽ CL,Hàng Gốm Sứ,TBCTL04.1,Cái,7,0,60.000,0
Túi rút lụa thêu hoa 19x19,"Túi xách, Làn, Ví",CLY/TT19,Cái,7,0,70.000,0
Cốc lúa mạch có quai,Hàng Gốm Sứ,CLM02,Cái,7,0,80.000,0
Xoài sấy dẻo muối ớt lọ 500g,"Đồ Ăn, Thức Uống",XSD/MO/L/500G,Lọ,7,0,120.000,0
Gác thìa hỏa biến,Hàng Gốm Sứ,HB/GTH,Cái,7,0,30.000,0
Cốc ngọc trai có quai,Hàng Gốm Sứ,C/NT/Q,Cái,7,0,90.000,0
Bộ áo dài cờ đỏ sao vàng,Quần Áo,CLY/AD/CDSV,Bộ,7,0,450.000,0
Bát mắm hỏa biến,Hàng Gốm Sứ,HB/BMM,Cái,7,0,40.000,0
"Trà tôm nõn gói nhỏ (đỏ,vàng)","Đồ Ăn, Thức Uống",TRA/TN/S,Gói,7,0,40.000,0
Thìa cơm hỏa biến sen,Hàng Gốm Sứ,THC/HB/SEN,Cái,7,0,35.000,0
Tranh đĩa F24 vẽ băng hoa,Hàng Gốm Sứ,ATDF24/04,Cái,7,0,1.500.000,0
Trà sen,"Đồ Ăn, Thức Uống",TRASEN,Lọ,7,0,350.000,0
Cà phê Arabica đã xay gói 200g,"Đồ Ăn, Thức Uống",CP/A/DX/200G,Gói,7,0,140.000,0
Xì gà LOTUS CLUB (10 điếu/bao),"Xì Gà, Thuốc Lá",8936031835552,Bao,7,0,300.000,0
Xì gà Vinaboss's 60 (ống nhôm 1 điếu),"Xì Gà, Thuốc Lá",XG/VNB/60,Điếu,7,0,650.000,0
Cà phê mix A+C+R 500g,"Đồ Ăn, Thức Uống",CP/ACR/500G,Gói,7,0,320.000,0
Set 5 chai Miss Saigon Elegance 15ml,Nước Hoa,8934662176150,Bộ,7,0,1.150.000,0
phin cà phê màu hồng cánh sen phi 7,Phin CF,PCP/HCS/7,Hộp,7,24.000,120.000,0
Nước hoa Miss VietNam N31 Sứ màu Sài Gòn 35ml,Nước Hoa,8934662133313,Chai,7,0,1.300.000,0
Trà ô long Phú Sỹ 100g ( màu đỏ),"Đồ Ăn, Thức Uống",8938505114491,Gói,7,0,100.000,0
Tranh bìa,Thủ công mỹ nghệ,KG05,Cái,7,0,40.000,0
Bình nu gỗ SM 11cm,Hàng Sơn Mài,SM/BNG/11,Cái,7,0,120.000,0
Cà phê phin giấy Hạnh Phúc,"Đồ Ăn, Thức Uống",CPC/CF/HP/F,Hộp,7,0,140.000,0
Cà phê túi lọc Hạnh Phúc,"Đồ Ăn, Thức Uống",CPC/CF/HP/L,Hộp,7,0,100.000,0
Trà phê túi lọc Cộng (2gr x20),"Đồ Ăn, Thức Uống",CPC/TP/L,Hộp,7,0,80.000,0
Trà nhài túi lọc 2x20,"Đồ Ăn, Thức Uống",CPC/TN/L,Hộp,7,0,100.000,0
Trà sen Star Kitchen,"Đồ Ăn, Thức Uống",8938532872562,Hộp,7,0,110.000,0
Nón Huế thêu hoa phi 40,"Nón, Nón treo",NHTH/40,Cái,7,0,100.000,0
Nón Huế trơn phi 40,"Nón, Nón treo",NHT/40,Cái,7,0,80.000,0
Hộp trang sức SM HCN KT 12x20,Hàng Sơn Mài,SM/HTS/12x20,Cái,7,0,400.000,0
Socola đen Bà Rịa 76% Marou 24g,"Đồ Ăn, Thức Uống",8938505214146,Thanh,6,0,75.000,0
Chén và đĩa thủy tinh của BAPT,"Giá Kệ, Công cụ, Dụng Cụ",CDTT/17.1,Chiếc,6,0,50.000,0
Gấu len chân ngắn đeo cờ Việt Nam,Len,LEN/GCNDCVN,Con,6,0,200.000,0
Túi mề gà thêu12x20,"Túi xách, Làn, Ví",CLY/TMG1220,Cái,6,0,70.000,0
Túi mề gà thêu 14x24,"Túi xách, Làn, Ví",CLY/TMG1424,Cái,6,0,80.000,0
Thìa Sup gỗ 22.5cm,"Đồ Ăn, Thức Uống",GO/SUP22.5,Cái,6,0,30.000,0
Kẹo Hải Hà cứng nhân cam gói 80g,"Đồ Ăn, Thức Uống",8936007390610,Gói,6,0,10.000,0
Bát mắm trâu sen,Hàng Gốm Sứ,TS/BMM,Cái,6,0,30.000,0
Cà phê Robusta Honey gói 500g,"Đồ Ăn, Thức Uống",CP/RH/500G,Gói,6,0,300.000,0
Phin cà phê màu cam phi 7,Phin CF,PCP/CAM/7,Hộp,6,0,120.000,0
NÓN DÂY TRƠN BỘ 7 CÁI,"Nón, Nón treo",NDT/7,Cái,6,0,150.000,0
Bộ ac in men HB các màu,Hàng Gốm Sứ,AAC0020,Bộ,6,0,1.200.000,0
Túi cỏ bàng vẽ,"Túi xách, Làn, Ví",TCBV,Cái,6,0,300.000,0
Nước hoa Miss SaiGon Elegance Amethyst N1 (Màu tím) 50ml,Nước Hoa,8934662176013,Chai,6,0,720.000,0
