Nước hoa Miss SaiGon Elegance Sapphire N2 (Màu xanh dương) 50ml,Nước Hoa,8934662176020,Chai,6,0,720.000,0
Nước hoa Miss SaiGon Elegance Amber N5 (Màu cam) 50ml,Nước Hoa,8934662176051,Chai,6,0,720.000,0
Khay tròn gắn trai KT: phi 24,"Khay tre, khảm trai, gỗ",KTGT/24,Cái,6,0,200.000,0
Đèn lồng tỏi 20cm,Đèn lồng,DL/TOI/20,Cái,6,0,100.000,0
Đèn lồng tỏi 10cm,Đèn lồng,DL/TOI/10,Cái,6,0,50.000,0
Quế sáo,"Đồ Ăn, Thức Uống",QSAO,Hộp,6,0,100.000,0
Đĩa kê cốc CF vàng,Hàng Gốm Sứ,DCF/V,Cái,6,0,20.000,0
Bộ AC hoả biến xanh các loại,Hàng Gốm Sứ,T/AC/XD/CL,Bộ,6,0,1.200.000,0
Bình na gỗ SM 10cm,Hàng Sơn Mài,SM/BNAG/10,Cái,6,0,120.000,0
Cắm bút gỗ SM 11cm,Hàng Sơn Mài,SM/CBG/11,Cái,6,0,120.000,0
Bình chai gỗ SM 20cm,Hàng Sơn Mài,SM/BCG/20,Cái,6,0,120.000,0
Khoai lang sấy Vinamit 250g,"Đồ Ăn, Thức Uống",8934743022925,Gói,6,0,65.000,0
Cà phê hòa tan G7 3in1 hộp dẹt 336g/ 21 gói,"Đồ Ăn, Thức Uống",8935024123287,Hộp,6,0,80.000,0
Cà phê hòa tan G7 3in1 50 gói / bịch 800g,"Đồ Ăn, Thức Uống",8935024129357,Gói,6,0,190.000,0
Trà I Wish You 10 (I Wish You 10 Loose Leaf Tea),"Đồ Ăn, Thức Uống",8938506647394,Hộp,6,0,200.000,0
Đèn lồng tre size L,Đèn lồng,DL/TRE/L,Cái,6,0,300.000,0
Lọ ly sơn mài 30,Hàng Sơn Mài,SM/LY30,Cái,6,0,200.000,0
Rượu Lúa Mới 40% 100ml (Hà Nội Opera House),Rượu,8934591007198,Chai,5,0,125.000,0
Rượu Vodka Hà Nội 40% 100ml (Hoàn Kiếm Lake),Rượu,8934591007181,Chai,5,0,125.000,0
Rượu Nếp Mới 40% 100ml (Khuê Văn Các ),Rượu,8934591007204,Chai,5,0,125.000,0
Mẹt F30 vẽ phong cảnh cl,Thủ công mỹ nghệ,TMET3001,Cái,5,0,600.000,0
Kẹo xoài Úc bóc vỏ Vietthai 255g,"Đồ Ăn, Thức Uống",8936029721980,Gói,5,0,35.000,0
Cà phê Cộng Bạc xỉu hòa tan 12 Stick,"Đồ Ăn, Thức Uống",8938531133640,Hộp,5,0,85.000,0
Bình Sơn mài ống chỉ,Hàng Sơn Mài,SM/BOCHI,Cái,5,0,200.000,0
Socola đen Đồng Nai 72% Marou 24g,"Đồ Ăn, Thức Uống",8938505214245,Thanh,5,0,75.000,0
Socola cà phê sữa VN 44% Marou 24g,"Đồ Ăn, Thức Uống",8938505214290,Thanh,5,0,80.000,0
Rượu dâu tằm hoa nhài 100ml,Rượu,8938528985337,Chai,5,0,150.000,0
Hộp cacao sữa Heyday,"Đồ Ăn, Thức Uống",8938512644417,Hộp,5,0,105.000,0
Tranh sơn mài vuông 15x15,Hàng Sơn Mài,SM/TR/V15,Cái,5,0,200.000,0
Tranh đĩa tròn Sơn mài cong phi 15,Hàng Sơn Mài,SM/TR/DTC15,Cái,5,0,200.000,0
bát cơm vẽ sen,Hàng Gốm Sứ,T/BC/SEN,Cái,5,0,50.000,0
Cà phê Robusta mix Arabica đã xay gói 200g,"Đồ Ăn, Thức Uống",CP/R/A/DX/200G,Gói,5,0,140.000,0
Bình thọ gỗ vuốt 18cm,Hàng Sơn Mài,SM/BTGV/18,Cái,5,0,150.000,0
Kẹp sách giấy gió,Thủ công mỹ nghệ,KSGG,Cái,5,0,15.000,0
Nước hoa Miss Saigon Elegance (màu đỏ) 50ml,Nước Hoa,8934662176204,Chai,5,0,720.000,0
Đĩa F15 HB sen,Hàng Gốm Sứ,HB/D/F15/S,Cái,5,0,150.000,0
Khay muối vuông trâu sen,Hàng Gốm Sứ,TS/KHM/V,Cái,5,0,40.000,0
Bộ AC Giang Tây hỏa biến,Hàng Gốm Sứ,TAC/HB03,Bộ,5,0,1.200.000,0
Cam sơn mài phi 14,Hàng Sơn Mài,SM/CAM14,Cái,5,0,160.000,0
Trà xanh hoa nhài đóng lọ,"Đồ Ăn, Thức Uống",TRA/HN/LO,Lọ,5,0,150.000,0
HẠT TIÊU ĐỎ,"Đồ Ăn, Thức Uống",HTIEU/DO,Hộp,5,0,60.000,0
Nụ hoa tam thất,"Đồ Ăn, Thức Uống",NU/HTT,Gói,5,0,100.000,0
Cà phê mix A+C+R gói 200g,"Đồ Ăn, Thức Uống",CP/ACR/200G,Gói,5,0,140.000,0
Cà phê Moka 500g,"Đồ Ăn, Thức Uống",CP/M/500G,Gói,5,0,350.000,0
Phin cà phê màu xanh lá phi 7,Phin CF,PCP/XL/7,Hộp,5,20.000,120.000,0
Lót ly sơn mài tròn,Hàng Sơn Mài,SM/LOTLY/TR,Bộ,5,0,200.000,0
Nước hoa Miss Việt Nam N27 Sứ trắng Sài Gòn 35ml,Nước Hoa,8934662133276,Chai,5,0,1.300.000,0
Nước hoa Miss Việt Nam N29 Sứ trắng Hà Nội 35ml,Nước Hoa,8934662133290,Chai,5,0,1.300.000,0
Cốc CF vẽ hoa các loại,Hàng Gốm Sứ,ACOCCF04,Cái,5,0,80.000,0
Nón cỏ bàng vẽ hoa sen thường phi 41,"Nón, Nón treo",NCBVHST/41,Cái,5,0,350.000,0
Xì gà HANOS - HNC52 ( ống nhôm 1 điếu),"Xì Gà, Thuốc Lá",XIGA/HNC52,Điếu,5,0,800.000,0
Trà cúc túi lọc Cộng (2gr x20),"Đồ Ăn, Thức Uống",CPC/TC/L,Hộp,5,0,80.000,0
cà phê hòa tan cappuccino hazelnut Trung Nguyên legend 216g 12x18g,"Đồ Ăn, Thức Uống",8935024122129,Hộp,5,0,90.000,0
MR.VIET Cà phê Hòa Tan Dừa 255g (MR.VIET Instant Coffee Coconut 255g),"Đồ Ăn, Thức Uống",8936135433401,Hộp,5,0,120.000,0
MR.VIET Good Morning Vietnam - Cà Phê Hạt Rang Túi 250g (GM Vietnam – Roasted Coffee Beans 250g Bag),"Đồ Ăn, Thức Uống",8936135430271,Gói,5,0,200.000,0
Đèn lồng tre size M,Đèn lồng,DL/TRE/M,Cái,5,0,250.000,0
Khay tròn gắn trai KT: phi 22,"Khay tre, khảm trai, gỗ",KTGT/22,Cái,5,0,170.000,0
Khay tròn gắn trai KT: phi 35,"Khay tre, khảm trai, gỗ",KTGT/35,Cái,5,0,280.000,0
Rượu cà phê 25% 100ml ( Hạ Long Bay),Rượu,8934591007235,Chai,4,0,125.000,0
Rượu Thanh Mai 25% 100ml (Huế Citadel),Rượu,8934591007228,Chai,4,0,125.000,0
Rượu dâu 19.5% 250ml,Rượu,8934591008713,Chai,4,0,75.000,0
Rượu vải 18% 250ml,Rượu,8934591008690,Chai,4,0,75.000,0
Cà phê hòa tan dừa Mr Việt 510g,"Đồ Ăn, Thức Uống",8936135434170,Gói,4,0,230.000,0
Túi cói quai xách đính hoa cúc KT 29x39,"Túi xách, Làn, Ví",TCQX/DHC/29x39,Cái,4,0,300.000,0
Bình củ Huệ sơn mài 15 cm,Hàng Sơn Mài,SM/L/CHUE/15,Cái,4,0,150.000,0
Socola đen Tiền Giang 70% Marou 24g,"Đồ Ăn, Thức Uống",8938505214443,Thanh,4,0,75.000,0
Socola đen Lâm Đồng 74% Marou 24g,"Đồ Ăn, Thức Uống",8938505214641,Thanh,4,0,75.000,0
Socola đen bến tre 78% Marou 24g,"Đồ Ăn, Thức Uống",8938505214344,Thanh,4,0,75.000,0
Rượu Thanh Long 530ml,Rượu,8938528985405,Chai,4,0,370.000,0
Rượu táo mèo yên bái 530ml,Rượu,8938528985009,Chai,4,0,370.000,0
Khoai môn sấy Vinamit 250g,"Đồ Ăn, Thức Uống",8934743022932,Gói,4,0,110.000,0
Túi xách thổ cẩm quai gỗ 2 khóa KT 32X32,"Túi xách, Làn, Ví",TC/TXQG2K/32X32,Cái,4,0,100.000,0
Bình Phu Thê cỡ nhỏ,Hàng Sơn Mài,SM/VC/S,Bộ,4,0,320.000,0
Bình Phu Thê dẹt cỡ nhỏ,Hàng Sơn Mài,S/VC/DET/S,Bộ,4,0,320.000,0
Đĩa F14 vẽ sen xanh lam,Hàng Gốm Sứ,T/DIA/SEN/F14,Cái,4,0,50.000,0
Đĩa F18 vẽ sen xanh lam,Hàng Gốm Sứ,T/DIA/SEN/F18,Cái,4,0,100.000,0
Cà phê Vinacafe Special 3 trong 1 hộp 306g,"Đồ Ăn, Thức Uống",8934683010914,Hộp,4,0,60.000,0
Túi xách hoa cúc dừa KT: 22x32,"Túi xách, Làn, Ví",TXHCD/22X32,Cái,4,0,100.000,0
Tranh sơn mài 15x20,Hàng Sơn Mài,SM/TR/15X20,Cái,4,0,250.000,0
Khay tròn gắn trai có quai Kt phi 30cm,"Khay tre, khảm trai, gỗ",KTGTCQ/30,Cái,4,0,270.000,0
4 cánh HB nhỏ sen,Hàng Gốm Sứ,HB/4C/S/SEN,Cái,4,0,40.000,0
Nón Bắc Bộ trẻ em vẽ cờ đỏ sao vàng phi 34,"Nón, Nón treo",NBBTEV/CDSV/34,Cái,4,0,60.000,0
Tranh thêu khung bo 24x30,Thủ công mỹ nghệ,SP220425,Cái,4,0,120.000,0
Thìa cà phê trắng thẳng,Hàng Gốm Sứ,THCF/TR/TH,Cái,4,0,10.000,0
Đĩa F15 HB,Hàng Gốm Sứ,HB/D/F15,Cái,4,0,80.000,0
Salat HB CL F18-24,Hàng Gốm Sứ,HB/SALAT/F18-24,Cái,4,0,250.000,0
Bát tô F16 men kem,Hàng Gốm Sứ,T/BT16/MK,Cái,4,0,110.000,0
Giỏ mây phi 30,"Túi xách, Làn, Ví",M/GM/F30,Cái,4,0,100.000,0
Khay chữ nhật gắn trai có quai Kt 33x23,"Khay tre, khảm trai, gỗ",KCNGTCQ/33X23,Cái,4,0,200.000,0
Cà phê Trung Tín hộp trống gỗ 150gr,"Đồ Ăn, Thức Uống",580011/HT,Hộp,4,0,300.000,0
Khay vuông gắn trai KT: 22cm,"Khay tre, khảm trai, gỗ",KVGT/22,Cái,4,0,190.000,0
phin cà phê màu xanh da trời f7,Phin CF,PCP/XDT/7,Hộp,4,0,120.000,0
phin cà phê màu đen phi 7,Phin CF,PCP/DEN/7,Hộp,4,0,120.000,0
Nước hoa Miss SaiGon Elegance Ruby N3 (Màu hồng) 50ml,Nước Hoa,8934662176037,Chai,4,0,720.000,0
Nước hoa Miss SaiGon Elegance Jade N6 (Màu xanh lá cây) 50ml,Nước Hoa,8934662176068,Lọ,4,0,720.000,0
Nước hoa Miss VietNam N32 Sứ màu Huế 35ml,Nước Hoa,8934662133320,Chai,4,0,1.300.000,0
Tích lộc mini vẽ sen,Hàng Gốm Sứ,ATL18160001,Cái,4,0,1.500.000,0
Bộ AC trâu sen,Hàng Gốm Sứ,AC29/SEN,Bộ,4,0,500.000,0
Thìa cơm sen,Hàng Gốm Sứ,T/TH/SEN,Cái,4,0,35.000,0
Cốc lọc cà phê cao TM,Hàng Gốm Sứ,CFTM01/H,Cái,4,0,120.000,0
Phin cà phê màu nâu phi 7,Phin CF,PCP/NAU/7,Hộp,4,35.000,120.000,0
Nấm đông trùng(lọ),"Đồ Ăn, Thức Uống",NAM/DTRUNG,Lọ,4,0,100.000,0
Trà xanh Thái Nguyên hộp đỏ 200g,"Đồ Ăn, Thức Uống",TRA/200G/H/D,Hộp,4,0,350.000,0
Trà xanh Thái Nguyên hộp vàng 200g,"Đồ Ăn, Thức Uống",TRA/200G/H/V,Hộp,4,0,350.000,0
Trà Sencha gói hút chân không gói 200g,"Đồ Ăn, Thức Uống",8936095570512,Gói,4,0,120.000,0
Sổ tre,Thủ công mỹ nghệ,KG/SO/TRE,Cái,4,0,60.000,0
Cà phê sữa đá Trung Nguyên legend 225g 9x25g,"Đồ Ăn, Thức Uống",8935024132500,Cái,4,0,120.000,0
MR.VIET Xoài Sấy Với Sôcôla Sữa & Dừa (MR.VIET Dried Mango Milk Chocolate & Coconut),"Đồ Ăn, Thức Uống",8936135431681,Gói,4,0,120.000,0
MR.VIET Xoài Sấy Với Matcha & Mắc Ca (MR.VIET Dried Mango Matcha & Macadamia),"Đồ Ăn, Thức Uống",8936135431704,Gói,4,0,120.000,0
"""Cà phê MR.VIET Real-Strong-Orginal-CàPhê Rang Xay hộp 250g (Real-Strong-Original-Ground 250g)-black""","Đồ Ăn, Thức Uống",8938506647615,Hộp,4,0,180.000,0
Quần áo dài,Quần Áo,CLY/Q,Cái,4,0,150.000,0
Khay tròn sơn mài hình gà phi 30,Hàng Sơn Mài,SM/KH/TR30,Cái,4,0,310.000,0
Tranh đĩa tròn Sơn Mài cong phi 25,Hàng Sơn Mài,SM/TR/DTC25,Cái,4,0,300.000,0
Khay tròn thảm gỗ có quai KT phi 28,"Khay tre, khảm trai, gỗ",KTTGCQ/28,Cái,4,0,200.000,0
Khay tròn gắn trai KT: phi 30,"Khay tre, khảm trai, gỗ",KTGT/30,Cái,4,0,240.000,0
Rươu chanh 25% 100ml (Bến Thành Market),Rượu,8934591007211,Chai,3,0,125.000,0
"Rượu Nàng Mận 25,5% 375ml",Rượu,8938528985634,Chai,3,0,300.000,0
"Rượu Nàng Mận 25,5% 530ml",Rượu,8938528985597,Chai,3,0,400.000,0
"Rượu Gái Mèo 25,5% 530ml",Rượu,8938528985610,Chai,3,0,400.000,0
Rượu mơ Má đào Mộc Châu 19% 530ml,Rượu,5023MC530,Chai,3,0,400.000,0
Trà Kim Tuyên gói hút chân không 200g,"Đồ Ăn, Thức Uống",8936095570710,Gói,3,0,100.000,0
Atiso đỏ,"Đồ Ăn, Thức Uống",ATISO,Lọ,3,0,60.000,0
Bình Sơn Mài Mang cá Vầng Trăng nhí 15.5 cm,Hàng Sơn Mài,SM/MCVTRANG/S,Cái,3,0,300.000,0
Rượu Sông Cái Floral Gin 700ml (45%),Rượu,R/FLORAL/700,Chai,3,0,1.500.000,0
Rượu Sông Cái Dry Gin 700ml (45%),Rượu,8938528319026,Chai,3,0,1.350.000,0
Socola Arabica coffee Lâm Đồng 64% Marou 80g,"Đồ Ăn, Thức Uống",8938505214665,Thanh,3,0,170.000,0
Socola đen Đắc lăk 70% Marou 80g,"Đồ Ăn, Thức Uống",8938505214726,Thanh,3,0,140.000,0
Socola đen Lâm Đồng 74% Marou 80g,"Đồ Ăn, Thức Uống",8938505214634,Thanh,3,0,140.000,0
Socola đen Đồng Nai 72% Marou 80g,"Đồ Ăn, Thức Uống",8938505214238,Thanh,3,0,140.000,0
Socola Mekong Kumquat Tiền Giang 68% Marou 80g,"Đồ Ăn, Thức Uống",8938505214450,Thanh,3,0,170.000,0
Socola Mekong Kumquat Tiền Giang 68% Marou 24g,"Đồ Ăn, Thức Uống",8938505214405,Thanh,3,0,85.000,0
Socola Coconut Milk Bến tre 55% Marou 24g,"Đồ Ăn, Thức Uống",8938505214375,Thanh,3,0,85.000,0
Rượu sim Yên Tử 250ml 24%,Rượu,8936105590103/250,Chai,3,0,200.000,0
Rượu cô chanh 530ml,Rượu,8938528985603,Chai,3,0,370.000,0
"Rượu nàng mận 25,5% 100ml",Rượu,8938528985542,Chai,3,0,150.000,0
Chân kê đĩa gỗ 15cm,Thủ công mỹ nghệ,CKD/15,Cái,3,0,40.000,0
Bình sơn mài vai vuông,Hàng Sơn Mài,SM/BVAIVUONG,Cái,3,0,500.000,0
Bình Sơn mài Mang cá Picatso lớn (36cm),Hàng Sơn Mài,SM/MCPICASO/L,Cái,3,0,500.000,0
Khay chữ nhật gắn trai có quai KT 34X24,"Khay tre, khảm trai, gỗ",KCNGTCQ/34X24,Cái,3,0,220.000,0
Doremon len,Len,LEN/DOREMON,Con,3,0,220.000,0
Móc khóa len vịt đeo chai đội nón,Len,LEN/MKVDCDN,Cái,3,0,60.000,0
Móc khóa len chó cờ,Len,LEN/MKCC,Cái,3,0,60.000,0
Bình Mang cá thấp,Hàng Sơn Mài,SM/MCT,Cái,3,0,360.000,0
Bình Phu Thê dẹt cỡ lớn,Hàng Sơn Mài,SM/VC/DET/L,Bộ,3,0,400.000,0
Đĩa ảo F20 sen xanh lam,Hàng Gốm Sứ,T/D/AO/SEN/20,Cái,3,0,150.000,0
Đĩa lượn 5 cánh vẽ sen F23,Hàng Gốm Sứ,T/D/5C/SEN/F23,Cái,3,0,200.000,0
Bát mắm vẽ sen,Hàng Gốm Sứ,T/BM/SEN,Cái,3,0,30.000,0
Đĩa F20 vẽ sen xanh lam,Hàng Gốm Sứ,T/DIA/SEN/F20,Cái,3,0,120.000,0
Túi xách đeo vai hoa ô vuông KT: 32x25cm,"Túi xách, Làn, Ví",TXDVHOV/32X25,Cái,3,0,100.000,0
Khay bầu dục gắn trai có quai Kt 24x37,"Khay tre, khảm trai, gỗ",KBDGTCQ/24X37,Cái,3,0,180.000,0
trà tâm sen lọ nhỏ,"Đồ Ăn, Thức Uống",TRA/TSEN/N,Lọ,3,0,200.000,0
Trà tôm nõn Thái Nguyên hộp 300g,"Đồ Ăn, Thức Uống",TRA/TN/300G,Hộp,3,0,600.000,0
kẹo Hải Hà chew đậu đỏ gói 90g,"Đồ Ăn, Thức Uống",8934595060496,Gói,3,0,10.000,0
Nón Bắc Bộ vẽ cờ đỏ sao vàng phi 40,"Nón, Nón treo",NBBV/CDSV/40,Cái,3,0,80.000,0
Nón cỏ bàng vẽ hoa sen nổi phi 41,"Nón, Nón treo",NCBVHSN/41,Cái,3,0,350.000,0
Kẹo Hải Hà Chew xốp cốm gói 70g,"Đồ Ăn, Thức Uống",8934595060038,Gói,3,0,10.000,0
Đĩa F20 HB sen,Hàng Gốm Sứ,HB/D/F20/S,Cái,3,0,220.000,0
Đĩa F20 Hb,Hàng Gốm Sứ,HB/D/F20,Cái,3,0,180.000,0
Bát tô F20 men kem,Hàng Gốm Sứ,T/BT20/MK,Cái,3,0,150.000,0
Đĩa F20 men kem,Hàng Gốm Sứ,T/D20/MK,Cái,3,0,90.000,0
Đĩa F22 men kem,Hàng Gốm Sứ,T/D22/MK,Cái,3,0,110.000,0
Đĩa muối trâu sen,Hàng Gốm Sứ,TS/DMU,Cái,3,0,30.000,0
Cà phê Robusta đã xay gói 200g,"Đồ Ăn, Thức Uống",CP/R/DX/200G,Gói,3,0,140.000,0
khay bầu dục gắn trai có quai KT: 18x30,"Khay tre, khảm trai, gỗ",KBDGTCQ/18X30,Cái,3,0,170.000,0
Nón bọc vải lụa 1 mặt phi 43,"Nón, Nón treo",NBVL/1/43,Cái,3,0,350.000,0
Xì gà LOTUS MINI NO2 (Hộp sắt màu vàng),"Xì Gà, Thuốc Lá",8936031835934,Hộp,3,0,250.000,0
Gạt tàn cú mèo,Hàng Gốm Sứ,AGT0008,Cái,3,0,50.000,0
Nón dây trơn bộ 5 cái,"Nón, Nón treo",NDT/5,Cái,3,0,120.000,0
Nón lá sen vẽ phi 41,"Nón, Nón treo",NLSV/41,Cái,3,0,500.000,0
Nước hoa Miss Việt Nam N28 Sứ trắng Huế 35ml,Nước Hoa,8934662133283,Chai,3,0,1.300.000,0
Nước hoa Miss VietNam N33 Sứ màu Hà Nội 35ml,Nước Hoa,8934662133337,Chai,3,0,1.300.000,0
Túi cói quai da KT: 40x44,"Túi xách, Làn, Ví",TCQD/40X44,Cái,3,0,260.000,0
Tích lộc mini vẽ sen chuồn HB,Hàng Gốm Sứ,ATL1816014,Cái,3,0,1.000.000,0
Bộ Ac trâu đào,Hàng Gốm Sứ,AC29/DAO,Bộ,3,0,500.000,0
Cốc Lipton,Hàng Gốm Sứ,CTM01,Cái,3,0,60.000,0
Phin cà phê màu vàng phi 7,Phin CF,PCP/VANG/7,Hộp,3,"14.285,71",120.000,0
Nón Bắc Bộ trơn phi 40,"Nón, Nón treo",NBBT/40,Cái,3,0,80.000,0
Bánh đậu xanh Hòa An hộp 200g,"Đồ Ăn, Thức Uống",8938539983247,Hộp,3,0,30.000,0
Nón dây bọc vải bộ 10 cái,"Nón, Nón treo",NDBV/10,Cái,3,0,600.000,0
Set sổ và bút Việt Nam,Thủ công mỹ nghệ,SET/S+B,Bộ,3,0,100.000,0
Túi xách vuông thổ cẩm KT phi 35cm,"Túi xách, Làn, Ví",TC/TXV/35,Cái,3,0,150.000,0
Trái cây sấy vinamit MP gói 250g,"Đồ Ăn, Thức Uống",8934743022963,Gói,3,0,100.000,0
Cà phê hòa tan cappuccino coconut Trung Nguyên legend 216g 12x18g,"Đồ Ăn, Thức Uống",8935024170403,Hộp,3,0,90.000,0
Bát gáo dừa cô gái đỏ,Hàng Sơn Mài,SM/BGD/GAI/D,Cái,3,0,50.000,0
Đèn lồng tre size S,Đèn lồng,DL/TRE/S,Cái,3,0,200.000,0
Lọ chày sơn mài 30,Hàng Sơn Mài,SM/L/CHAY/30,Cái,3,0,200.000,0
Bát tô F16 hỏa biến sen CL,Hàng Gốm Sứ,HB/BT/F16/SEN,Cái,2,0,250.000,0
"Rượu Gái Mèo 25,5% 375ml",Rượu,8938528985658,Chai,2,0,300.000,0
"Rượu Em Mơ 29,5% 375ml",Rượu,8938528985627,Chai,2,0,300.000,0
Rượu Mùa cốm 28% 530ml,Rượu,8938528985801,Chai,2,0,400.000,0
Đĩa lượn 5 cánh vẽ sen F21,Hàng Gốm Sứ,T/D/5C/SEN/F21,Cái,2,0,180.000,0
Trà hoa nhài lọ,"Đồ Ăn, Thức Uống",TRA/H/LO,Lọ,2,0,60.000,0
Bình Sơn Mài Mang cá mới nhí 18 cm,Hàng Sơn Mài,SM/BMCM/S,Cái,2,0,300.000,0
Bình A Còng 30 cm,Hàng Sơn Mài,BACONG/30,Cái,2,0,600.000,0
Trà cung đình hộp màu đỏ G10,"Đồ Ăn, Thức Uống",TCD/H/DO/G10,Hộp,2,0,200.000,0
Rượu Sông Cái Spiced Roselle Flavored Gin 220ml (45%),Rượu,R/SPICED/220,Chai,2,0,650.000,0
Rượu Sông Cái Spiced Roselle Flavored Gin 700ml (32.5%),Rượu,8938528319064,Chai,2,0,1.800.000,0
Trà cung đình gói màu cam G10 kèm gói KM uống thử,"Đồ Ăn, Thức Uống",8938506776063,Gói,2,0,100.000,0
Nón Huế vẽ cờ đỏ sao vàng phi 40,"Nón, Nón treo",NHVCDSV/40,Cái,2,0,80.000,0
Socola đen Bà Rịa 76% Marou 80g,"Đồ Ăn, Thức Uống",8938505214153,Thanh,2,0,140.000,0
Socola coconut milk Bến Tre 55% Marou 80g,"Đồ Ăn, Thức Uống",8938505214368,Thanh,2,0,170.000,0
Socola đen Đăk Lăk 70% Marou 24g,"Đồ Ăn, Thức Uống",8938505214801,Thanh,2,0,75.000,0
Phin pha cà phê K.H Trung Nguyên,Phin CF,PHINCF/KH/TN,Cái,2,0,120.000,0
cafe hương chồn Wake up 306g,"Đồ Ăn, Thức Uống",8934683007037,Hộp,2,0,70.000,0
Khỉ len chân ngắn,Len,LEN/KCN,Con,2,0,200.000,0
Thỏ len dâu,Len,LEN/TD,Con,2,0,200.000,0
Thỏ ngọc len,Len,LEN/TN,Con,2,0,400.000,0
Móc khóa len Minion,Len,LEN/MKMINION,Cái,2,0,100.000,0
Lọ Tỏi Sơn Mài 25,Hàng Sơn Mài,SM/L/TOI/25,Cái,2,0,200.000,0
Bình Sơn Mài vòi công cỡ lớn 39 cm,Hàng Sơn Mài,SM/BVCONG/L/39,Cái,2,0,380.000,0
Bình Sơn Mài vòi Công cỡ trung 32 cm,Hàng Sơn Mài,SM/BVCONG/M/32,Cái,2,0,350.000,0
Bình Sơn Mài Vòi Công cỡ nhỏ 27 cm,Hàng Sơn Mài,SM/BVCONG/S/27,Cái,2,0,320.000,0
Bình Sơn Mài Giọt Nước 31 cm,Hàng Sơn Mài,SM/BGNUOC/31,Cái,2,0,320.000,0
Bình Sơn Mài Xoăn cỡ lớn,Hàng Sơn Mài,SM/BXOAN/L,Cái,2,0,360.000,0
Bình Phu Thê dẹt cỡ trung,Hàng Sơn Mài,SM/VC/DET/M,Bộ,2,0,360.000,0
Lọ huệ S2 vẽ sen,Hàng Gốm Sứ,ALH251301,Chiếc,2,0,300.000,0
GBA Trà bình minh,"Đồ Ăn, Thức Uống",8935305200782,Hộp,2,0,200.000,0
GBA Trà 54 dân tộc,"Đồ Ăn, Thức Uống",8935305200911,Hộp,2,0,250.000,0
GBA Trà hoa hồng,"Đồ Ăn, Thức Uống",8935305200058,Hộp,2,0,250.000,0
Khay bầu dục gắn trai có quai Kt 20x33,"Khay tre, khảm trai, gỗ",KBDGTCQ/20X33,Cái,2,0,170.000,0
Xoài sấy dẻo Sao Khuê,"Đồ Ăn, Thức Uống",8938510945240,Gói,2,0,50.000,0
Kẹo hải hà Jelly trái cây gói 100g,"Đồ Ăn, Thức Uống",8934595063183,Gói,2,0,20.000,0
Khay chữ nhật gắn trai có quai KT: 36x26,"Khay tre, khảm trai, gỗ",KCNGTCQ/36X26,Cái,2,0,220.000,0
KHAY NAN HCN 13x18 sen,Hàng Gốm Sứ,HB/KH/NAN1318/S,Cái,2,0,250.000,0
Bát tô F20 hỏa biến sen CL,Hàng Gốm Sứ,HB/BT/F20/SEN,Cái,2,0,350.000,0
Bát tô F13-14 hỏa biến sen CL,Hàng Gốm Sứ,HB/BT/F13-14/S,Cái,2,0,160.000,0
Ấm mắm hoả biến sen,Hàng Gốm Sứ,HBHB/AMM/SEN,Cái,2,0,120.000,0
Chó S1 Deco,Hàng Gốm Sứ,THHTT02/S1,Con,2,0,100.000,0
Mèo cá S1,Hàng Gốm Sứ,THHTT01/S1,Con,2,0,130.000,0
Cú lùn S2,Hàng Gốm Sứ,THHTT09/S2,Con,2,0,90.000,0
Cú lùn S1,Hàng Gốm Sứ,THHTT09/S1,Con,2,0,130.000,0
Bộ khố nam thổ cẩm Tây Nguyên,Quần Áo,BK/NAM/TC/TN,Bộ,2,0,1.000.000,0
Áo già làng Tây Nguyên,Quần Áo,AGL/TN,Cái,2,0,1.000.000,0
Bát cơm HB,Hàng Gốm Sứ,HB/BC,Cái,2,0,70.000,0
Đĩa kê ấm của bộ AC TTS siêu hoa,Hàng Gốm Sứ,DIA/TTS/10,Cái,2,0,100.000,0
Trà đinh gói nhỏ 10gr,"Đồ Ăn, Thức Uống",TRA/DB/10GR,Gói,2,0,40.000,0
Làn cói có khóa đính quả bông,"Túi xách, Làn, Ví",LC/K/QB,Cái,2,0,270.000,0
Tranh đĩa F24 vẽ hoa,Hàng Gốm Sứ,ATDF24/05,Cái,2,0,1.500.000,0
Cà phê Trung Tín hộp bột Arabica có phin 250gr,"Đồ Ăn, Thức Uống",580097/P,Hộp,2,0,200.000,0
Lục bình cổ ngắn 1m3 vẽ tứ cảnh vẽ vàng bọc đồng,Hàng Gốm Sứ,BLBV304006BD,Cái,2,0,300.000.000,0
Bộ Ac thờ men kem,Hàng Gốm Sứ,TACHD007,Bộ,2,0,350.000,0
Bộ AC men HB,Hàng Gốm Sứ,AAC088,Bộ,2,0,1.200.000,0
Xì gà Pyramide extra 54,"Xì Gà, Thuốc Lá",8936009053148,Hộp,2,0,6.500.000,0
Xì gà LOTUS S (hộp giấy 25 điếu),"Xì Gà, Thuốc Lá",8936031839154,Hộp,2,0,1.000.000,0
CAPHE ROBUSTA MIX ARABICA GÓI 200G,"Đồ Ăn, Thức Uống",CP/R/A/200G,Gói,2,0,140.000,0
CÀ PHÊ ROBUSTA GÓI 200G,"Đồ Ăn, Thức Uống",CP/R/200G,Gói,2,0,140.000,0
CAPHE ARABICA GÓI 200G,"Đồ Ăn, Thức Uống",CP/A/200G,Gói,2,0,140.000,0
Đĩa bộ ac men gấm cl,Hàng Gốm Sứ,T/AC/GAM/CL_DLE,Cái,2,0,1.200.000,0
Đồ chơi mini,Hàng Gốm Sứ,DOCHOI,Cái,2,0,30.000,0
phin cà phê màu đỏ phi 7,Phin CF,PCP/DO/7,Hộp,2,2.560,120.000,0
Đĩa rẻ quạt HB sen,Hàng Gốm Sứ,HB/D/QUAT/SEN,Cái,2,0,250.000,0
Ba lô thổ cẩm to KT: 30x35,"Túi xách, Làn, Ví",TC/BL/30X35,Cái,2,0,200.000,0
Áo cô màu hồng size M,Quần Áo,AC/H/M,Cái,2,0,2.500.000,0
Cà phê Robusta mix Arabica 500g,"Đồ Ăn, Thức Uống",CP/R/A/500G,Gói,2,0,320.000,0
Làn nhựa quai da cỡ M KT: 25x39,"Túi xách, Làn, Ví",LNQD/M/25-39,Chiếc,2,0,250.000,0
Làn nhựa quai da cỡ trung,"Túi xách, Làn, Ví",LNQD/M,Chiếc,2,62.500,250.000,0
Ly có nắp H24 vẽ các loại,Hàng Gốm Sứ,TCOCTL08,Cái,2,0,400.000,0
"Cốc lúa mạch có nắp,quai",Hàng Gốm Sứ,CLM04,Cái,2,0,100.000,0
Nón cỏ bàng vẽ hoa thường phi 41,"Nón, Nón treo",NCBVHT/41,Cái,2,0,350.000,0
Hoa hòe,"Đồ Ăn, Thức Uống",HHOE,Hộp,2,0,100.000,0
Trà hoa cúc (lọ),"Đồ Ăn, Thức Uống",TRA/HCUC,Lọ,2,0,60.000,0
Hạt tiêu đen,"Đồ Ăn, Thức Uống",HTIEU,Hộp,2,0,60.000,0
Cốc vuốt sen HB,Hàng Gốm Sứ,HB/C/V/SEN,Cái,2,0,90.000,0
Trà xanh Thái Nguyên 100g nhãn xanh 1,"Đồ Ăn, Thức Uống",TRA/100G/X/1,Gói,2,60.000,150.000,0
Khay đựng mứt SM F28,Hàng Sơn Mài,SM/KHM/F28,Cái,2,0,1.000.000,0
Kẹp sách giấy xoắn,Thủ công mỹ nghệ,KSGX,Cái,2,0,30.000,0
Ví thổ cẩm hình cú khoá chuông KT 22x13,"Túi xách, Làn, Ví",TC/VHC,Cái,2,0,100.000,0
Xì gà HANOS - HNC52 (hộp sơn mài 10 điếu/ hộp),"Xì Gà, Thuốc Lá",8936009052578,Hộp,2,0,8.000.000,0
Xì gà Motesco 55 in Lacquer Box (10 điếu/hộp),"Xì Gà, Thuốc Lá",8936009053124,Hộp,2,0,5.500.000,0
MR.VIET Cà phê Hòa Tan 3 trong 1 (MR.VIET 3 in 1 Instant Coffee),"Đồ Ăn, Thức Uống",8936135430226,Gói,2,0,120.000,0
Khay tròn thảm gỗ có quai KT phi 24,"Khay tre, khảm trai, gỗ",KTTGCQ/24,Cái,2,0,160.000,0
Bộ AC TTS siêu hoa,Hàng Gốm Sứ,TTS10,Bộ,2,0,2.000.000,0
BỘ AC TTS SEN CÁ NỔI,Hàng Gốm Sứ,TTS/SC,Bộ,2,0,2.000.000,0
Tranh đĩa sen tròn SM cong phi 20,Hàng Sơn Mài,SM/TR/DSTC20,Cái,2,0,300.000,0
Khay tre tròn KT: phi 35 x 5cm,"Khay tre, khảm trai, gỗ",KTT/35X5,Cái,2,0,250.000,0
Khay tròn gắn trai có quai KT phi 24cm,"Khay tre, khảm trai, gỗ",KTGTCQ/24,Cái,2,0,220.000,0
Khay tròn gắn trai có quai KT: phi 28cm,"Khay tre, khảm trai, gỗ",KTGTCQ/28,Cái,2,0,250.000,0
Bình A còng SM 22 cm,Hàng Sơn Mài,BACONG/22,Cái,2,0,500.000,0
Cược vỏ Heineken + 24 vỏ chai,"Đồ Ăn, Thức Uống",C/K,Vỏ,1,0,60.000,0
Chó len chân ngắn,Len,LEN/CCN,Con,1,0,200.000,0
Thỏ len váy thêu hoa,Len,LEN/TVTH,Con,1,0,200.000,0
Ngựa len pony sừng ngũ sắc,Len,LEN/NPONYSNS,Con,1,0,300.000,0
Thỏ len váy cầu vồng búp bê,Len,LEN/TVCVBB,Con,1,0,200.000,0
Kẹo xốp TARO khoai môn Hải Hà 70g,"Đồ Ăn, Thức Uống",8934595060779,Gói,1,0,10.000,0
Kẹo dẻo xoài vàng bóc vỏ Vietthai 255g,"Đồ Ăn, Thức Uống",8936029721843,Gói,1,0,35.000,0
Cà phê Cộng sữa hòa tan 12 Stick,"Đồ Ăn, Thức Uống",8938531133633,Hộp,1,0,70.000,0
Bình Sơn mài mang cá lỗ Lớn 34 cm,Hàng Sơn Mài,SM/BMCLL/L,Cái,1,0,500.000,0
Bình Sơn mài mang cá lỗ Trung 27 cm,Hàng Sơn Mài,SM/BMCLT/M,Cái,1,0,420.000,0
Thỏ len yếm nam size to,Len,LEN/TYN/TR,Con,1,0,300.000,0
Rượu Sông Cái Dry Gin 220ml (45%),Rượu,R/DRYGIN220,Chai,1,0,525.000,0
Rượu Sông Cái Floral Gin 220ml (45%),Rượu,8938528319996,Chai,1,0,600.000,0
Trà cung đình gói màu đỏ G10 kèm gói nhỏ KM uống thử,"Đồ Ăn, Thức Uống",89338506776032,Gói,1,0,100.000,0
Đĩa muối vẽ hoa cl,Hàng Gốm Sứ,ADM03,Cái,1,0,30.000,0
Bình A còng 17 cm,Hàng Sơn Mài,BACONG/17,Cái,1,0,450.000,0
Bình Sơn Mài Vầng Trăng đại,Hàng Sơn Mài,SM/BVTRANG/L,Cái,1,0,400.000,0
Socola đen Tiền Giang 70% Marou 80g,"Đồ Ăn, Thức Uống",8938505214436,Thanh,1,0,140.000,0
Socola cà phê sữa 44% Marou 80g,"Đồ Ăn, Thức Uống",8938505214283,thanh,1,0,155.000,0
Socola trắng Việt NamVanilla44% Marou 80g,"Đồ Ăn, Thức Uống",8938551295137,Thanh,1,0,155.000,0
Tranh đĩa tròn sơn mài phi 45,Hàng Sơn Mài,SM/TR/DTR/45,Cái,1,0,950.000,0
Tranh đĩa tròn sơn mài Phố Cổ phi 45,Hàng Sơn Mài,SM/TR/DTRPCO/45,Cái,1,0,950.000,0
Bộ ấm pha trà thủy tinh gồm bếp và ấm (không chén),"Giá Kệ, Công cụ, Dụng Cụ",BAPT/TT/BA,Cái,1,0,500.000,0
Tranh đĩa tròn sơn mài PICATSO cong phi 20,Hàng Sơn Mài,SM/TR/DTCPICATSO/20,Cái,1,0,250.000,0
Bình sơn mài mang cá vầng trăng (26 cm),Hàng Sơn Mài,SM/MCVTRANG,Cái,1,0,450.000,0
Bình sơn mài xoăn cỡ nhỏ,Hàng Sơn Mài,SM/BXOAN/S,Cái,1,0,300.000,0
